{
  "schema": "https://vmblu.dev/schemas/capabilities.v1.json",
  "version": 1,
  "provenance": {
    "generated": true,
    "artifact": "capabilities",
    "compatibilityFamily": "1.12",
    "schemaVersion": "1.12.4",
    "generator": {
      "name": "@vizualmodel/vmblu-core",
      "version": "1.12.4"
    },
    "source": {
      "model": "webview.mod.blu",
      "hash": "fnv1a64:fc53ffc5b702167a"
    }
  },
  "application": {
    "id": "webview",
    "title": "webview",
    "description": "webview application."
  },
  "tools": [],
  "probes": [],
  "events": [],
  "policies": {
    "defaultApproval": "never"
  },
  "usageGuidance": {
    "principles": [
      "Use tools to change application state.",
      "Use probes to verify effects.",
      "Use events for asynchronous observations.",
      "Do not assume that a tool call succeeded unless a result, probe, or event confirms it."
    ]
  }
}